[
  {
    "id": "max_ndvi",
    "type": "openeo",
    "description": "max_ndvi example",
    "backend": "openeofed.dataspace.copernicus.eu",
    "process_graph": {
      "maxndvi1": {
        "process_id": "max_ndvi",
        "namespace": "https://raw.githubusercontent.com/ESA-APEx/apex_algorithms/f99f351d74d291d628e3aaa07fd078527a0cb631/openeo_udp/examples/max_ndvi/max_ndvi.json",
        "arguments": {
          "bbox": {
            "west": 5.07,
            "east": 5.09,
            "south": 51.21,
            "north": 51.23
          },
          "temporal_extent": [
            "2023-08-01",
            "2023-09-30"
          ]
        },
        "result": true
      }
    }
  }
]
