[
    {
        "id": "s2_sam",
        "type": "openeo",
        "description": "Run Sentinel-2 based Spectral Angle Mapping (S2-SAM) on a monthly BAP composite and return the best matching USGS spectral library class index per pixel.",
        "backend": "openeofed.dataspace.copernicus.eu",
        "process_graph": {
            "s2sam1": {
                "arguments": {
                    "spatial_extent": {
                        "crs": {
                            "properties": {
                                "name": "urn:ogc:def:crs:OGC:1.3:CRS84"
                            },
                            "type": "name"
                        },
                        "features": [
                            {
                                "geometry": {
                                    "coordinates": [
                                        [
                                            [
                                                [
                                                    14.603147526122228,
                                                    46.28089062404797
                                                ],
                                                [
                                                    14.620565004791132,
                                                    46.28089062404797
                                                ],
                                                [
                                                    14.620565004791132,
                                                    46.27187801679233
                                                ],
                                                [
                                                    14.603147526122228,
                                                    46.27187801679233
                                                ],
                                                [
                                                    14.603147526122228,
                                                    46.28089062404797
                                                ]
                                            ]
                                        ]
                                    ],
                                    "type": "MultiPolygon"
                                },
                                "properties": {
                                    "id": 0
                                },
                                "type": "Feature"
                            }
                        ],
                        "name": "slovenia",
                        "type": "FeatureCollection"
                    },
                    "temporal_extent": [
                        "2024-04-01",
                        "2024-04-30"
                    ]
                },
                "namespace": "https://raw.githubusercontent.com/ESA-APEx/apex_algorithms/1fba3ba1bb02cc42c8758a60880b90adf8b54a10/algorithm_catalog/terravision/s2_sam/openeo_udp/s2_sam.json",
                "process_id": "s2_sam"
            },
            "saveresult1": {
                "arguments": {
                    "data": {
                        "from_node": "s2sam1"
                    },
                    "format": "GTiff",
                    "options": {}
                },
                "process_id": "save_result",
                "result": true
            }
        }
    }
]