[
  {
    "id": "solar_pv_detection",
    "type": "openeo",
    "description": "Solar PV detection (ONNX) benchmark over a small AOI in California, inspired by the upstream test_udp_onnx.py.",
    "backend": "openeofed.dataspace.copernicus.eu",
    "process_graph": {
      "solarpv1": {
        "process_id": "solar_pv_detection",
        "namespace": "https://raw.githubusercontent.com/ray-climate/solar_openEO/main/openeo_udp/process_graph/solar_pv_detection_udp.json",
        "arguments": {
          "spatial_extent": {
            "west": -120.10,
            "south": 35.38,
            "east": -120.00,
            "north": 35.45,
            "crs": "EPSG:4326"
          },
          "end_date": "2024-09-30",
          "months": 3
        },
        "result": true
      }
    }
  }
]
